title,description,creator,maintainer,update_date,access_url,download_base_url,download_url,byte_size,media_type,compression_format,package_format,frequency,temporal_coverage
Aggregate Analysis of ClinicalTrials.gov,A relational database containing information about clinical studies that have been registered at ClinicalTrials.gov,Clinical Trials Transformation Intiative (CTTI),Clinical Trials Transformation Intiative (CTTI),,https://aact.ctti-clinicaltrials.org/snapshots,https://aact.ctti-clinicaltrials.org/static/static_db_copies/daily,,,"zip, png, html, dmp",zip,zip,Daily,2000-Present
Drugs@FDA,Information about FDA-approved brand name and generic prescription and over-the-counter human drugs and biological therapeutic products. ,U.S. Food and Drug Administration (FDA) ,Center for Drug Evaluation and Research (CDER) ,,https://www.fda.gov/drugs/drug-approvals-and-databases/drugsfda-data-files,https://www.fda.gov,,,tsv,zip,zip,Weekly,1939-Present
Purple Book,"The Purple Book database contains information on all FDA-licensed (approved) biological products regulated by the Center for Drug Evaluation and Research (CDER), including licensed biosimilar and interchangeable products, and their reference products. ",U.S. Food and Drug Administration (FDA) ,Center for Biologics Evaluation and Research (CBER),,https://purplebooksearch.fda.gov/downloads,https://purplebooksearch.fda.gov/files/2021,,,csv,zip,zip,On Demand,1909-Present
Human Drug Labeling,Essential scientific information needed for safe and effective use of human prescription drug or biological product.,U.S. Food and Drug Administration (FDA) ,openFDA,,https://open.fda.gov/data/downloads/,https://download.open.fda.gov/drug/label,,,json,zip,zip,Weekly,1939-Present
ChEMBL,ChEMBL is a manually curated database of bioactive molecules with drug-like properties.,European Molecular Biology Laboratory (EMBL),EMBL-EBI,,https://ftp.ebi.ac.uk/pub/databases/chembl/ChEMBLdb/latest/,https://ftp.ebi.ac.uk/pub/databases/chembl/ChEMBLdb/latest,https://ftp.ebi.ac.uk/pub/databases/chembl/ChEMBLdb/latest/chembl_28_postgresql.tar.gz,,dmp,tar.gz,tar.gz,Weekly,2009-Present
Target-Disease Evidence,"Open Targets consortium, the Platform builds and scores target-disease associations to assist in drug target identification and prioritisation",Open Targets,Open Targets,,https://platform.opentargets.org/downloads,,,,"tsv, json",,,,
Drug-Mechanism of Action,"Open Targets consortium, the Platform builds and scores target-disease associations to assist in drug target identification and prioritisation",Open Targets,Open Targets,,https://platform.opentargets.org/downloads,,,,"tsv, json",,,,
